<?xml version="1.0" encoding="UTF-8"?>
<dataset_registry xmlns:xsi="http://www.w3.org/2001/XMLSchema-instance" xsi:noNamespaceSchemaLocation="https://data.gulfresearchinitiative.org/schema/dataset_registry/dataset_registry.xsd">
    <entry>
        <registration_user id="1"/>
        <dataset>
            <source type="gomri">
                <funding_cycle reference="R01">
                    <project id="1">
                        <task id="1">
                            <dif sequence="1"/>
                            <originator id="2"/>
                            <point_of_contact id="3"/>
                        </task>
                    </project>
                </funding_cycle>
            </source>
            <title>My First Dataset Title</title>
            <abstract>My First Dataset Abstract</abstract>
        </dataset>
        <access_control restricted="false"/>
        <transport method="http" pull="true">
            <data_url>http://www.myserver.org/path/to/data_file_1</data_url>
            <metadata_url>http://www.myserver.org/path/to/metadata_file_1</metadata_url>
        </transport>
    </entry>
    <entry>
        <registration_user id="1"/>
        <dataset>
            <source type="gomri">
                <funding_cycle reference="R01">
                    <project id="1">
                        <task id="1">
                            <dif sequence="2"/>
                            <originator id="2"/>
                            <point_of_contact id="3"/>
                        </task>
                    </project>
                </funding_cycle>
            </source>
            <title>My Second Dataset Title</title>
            <abstract>My Second Dataset Abstract</abstract>
        </dataset>
        <access_control restricted="true"/>
        <transport method="http" pull="true">
            <data_url>http://www.myserver.org/path/to/data_file_2</data_url>
            <metadata_url>http://www.myserver.org/path/to/metadata_file_2</metadata_url>
        </transport>
    </entry>
</dataset_registry>
